{
  "schema_version": "character-skill-s2-shadow-minimal-transport-sanity/0.1.0",
  "protocol_version": "0.2.1",
  "run_id": "cs-s2-minimal-transport-sanity-v0.1.0-opencode_go-deepseek-v4-pro-t60-r0-n1-6a5a9a479af4d4ee7a00e1719c578c128fa00658-run-01",
  "experiment_type": "minimal_transport_sanity",
  "source_commit": "6a5a9a479af4d4ee7a00e1719c578c128fa00658",
  "manifest_digest": "910f0d1da5c657460f864d085d7223dc618d1f4fa283f0fb2e5f1b5274474ec7",
  "input_manifest_digest": "910f0d1da5c657460f864d085d7223dc618d1f4fa283f0fb2e5f1b5274474ec7",
  "inputs": [
    {
      "path": "evals/fixtures/hermes_character_skill_s0_blind_cases_v0.1.1.json",
      "sha256": "055505916bf82fc60cb55d2deb84b9aaacd7028431ac5d38d2f84791dd77fe90",
      "role": "provider"
    },
    {
      "path": "evals/fixtures/character_skill_interface_prototype_cases_v0.1.1.public.json",
      "sha256": "11e936df853927154ace426c3a22e073b739b9b1dce536817851f70cf855ec04",
      "role": "evaluator"
    }
  ],
  "provider": {
    "name": "opencode_go",
    "model_requested": "deepseek-v4-pro",
    "model_reported": "deepseek-v4-pro",
    "transport": "openai_chat_completions",
    "structured_output_mode": "json_object",
    "timeout_seconds": 60,
    "max_transport_retries": 0
  },
  "timeout_seconds": 60,
  "max_transport_retries": 0,
  "target_sample_count": 1,
  "complete": true,
  "tiny_contract_version": "minimal-status-object/0.1.0",
  "sample_index": 1,
  "observation": {
    "observation_id": "cs-s2-minimal-transport-sanity-v0.1.0-opencode_go-deepseek-v4-pro-t60-r0-n1-6a5a9a479af4d4ee7a00e1719c578c128fa00658-run-01:sample-01",
    "provider_outcome": "success",
    "transport_attempts": 1,
    "latency_ms": 4217.999999999847,
    "json_extraction_outcome": "parsed",
    "tiny_contract_outcome": "TRANSPORT_SUCCESS_CONTRACT_PASS",
    "parsed_top_level_type": "object",
    "expected_key_count": 1,
    "actual_key_count": 1,
    "failure_stage": null,
    "failure_code": null,
    "sanitization": {
      "raw_prompt_stored": false,
      "raw_response_stored": false,
      "secrets_detected": false
    }
  },
  "bundle_digest": "b0836a59e3db49e69de053a248e5362909abd797a61c1b35a4ddf2a64de6e76a"
}
